{
  "projectId": "proj-sample-philosophy",
  "title": "Khái luận về Triết học và Triết học Mác - Lênin",
  "theme": {
    "colorScheme": "academic-ocean",
    "fontFamily": "Inter, sans-serif",
    "aspectRatio": "16:9"
  },
  "totalDurationSeconds": 165.5,
  "slides": [
    {
      "slideId": "slide-01",
      "templateId": "title-slide",
      "layoutVariant": "default",
      "title": "Triết học và Triết học Mác - Lênin",
      "subtitle": "Chương I: Khái luận về triết học và vai trò của triết học trong đời sống xã hội",
      "elements": [],
      "animations": [
        {
          "target": "#badge-course",
          "preset": "fade-in",
          "delay": 0.2,
          "duration": 0.8,
          "easing": "power2.out"
        },
        {
          "target": ".slide-title",
          "preset": "slide-in",
          "delay": 0.6,
          "duration": 1.0,
          "easing": "power2.out"
        },
        {
          "target": "#img-hero",
          "preset": "zoom-in",
          "delay": 1.2,
          "duration": 1.2,
          "easing": "back.out"
        }
      ],
      "voice": {
        "narration": "Chào mừng các bạn sinh viên đến với bài giảng Khái luận về Triết học và Triết học Mác - Lênin.",
        "provider": "vieneu",
        "voiceId": "MyDuyen",
        "audioUrl": "storage/projects/sample/audio/slide-01.wav",
        "durationSeconds": 15.2
      },
      "durationSeconds": 16.0,
      "notes": "Slide mở đầu, giới thiệu tác giả và môn học.",
      "layoutId": "title-slide",
      "variantId": "default",
      "slotValues": {
        "badge": "Lý luận chính trị đại cương",
        "author": "Giảng viên: Bộ môn Triết học Mác - Lênin",
        "media": "storage/projects/sample-project/images/philosophy_intro.png"
      },
      "media": [
        {
          "id": "img-hero",
          "source": "document",
          "type": "image",
          "url": "storage/projects/sample-project/images/philosophy_intro.png",
          "alt": "Triết học và Triết học Mác - Lênin",
          "relevance": 1.0,
          "license": "educational-fair-use"
        }
      ]
    },
    {
      "slideId": "slide-02",
      "templateId": "learning-objectives",
      "layoutVariant": "stacked-top",
      "title": "Mục tiêu bài học",
      "subtitle": "3 chuẩn đầu ra cốt lõi của chương",
      "elements": [],
      "animations": [
        {
          "target": ".obj-item-0",
          "preset": "step-by-step",
          "delay": 1.0,
          "duration": 0.8,
          "easing": "power2.out"
        }
      ],
      "voice": {
        "narration": "Trong bài học này, chúng ta cần hoàn thành 3 mục tiêu cốt lõi.",
        "provider": "vieneu",
        "voiceId": "MyDuyen",
        "audioUrl": "storage/projects/sample/audio/slide-02.wav",
        "durationSeconds": 14.0
      },
      "durationSeconds": 15.0,
      "notes": "Nhấn mạnh từng mục tiêu theo thứ tự xuất hiện.",
      "layoutId": "learning-objectives",
      "variantId": "stacked-top",
      "slotValues": {
        "bullets": [
          "1. Nắm vững định nghĩa khoa học và đối tượng của Triết học",
          "2. Phân biệt rõ hai mặt của Vấn đề cơ bản của Triết học",
          "3. Hiểu được tiền đề lịch sử - khoa học ra đời của Triết học Mác"
        ]
      },
      "media": []
    },
    {
      "slideId": "slide-03",
      "templateId": "concept-explain",
      "layoutVariant": "text-left-image-right",
      "title": "Khái niệm Triết học",
      "subtitle": "Nguồn gốc từ Hy Lạp cổ đại (Philosophia)",
      "elements": [],
      "animations": [
        {
          "target": "#txt-def",
          "preset": "typewriter",
          "delay": 0.5,
          "duration": 2.0,
          "easing": "none"
        }
      ],
      "voice": {
        "narration": "Triết học là hệ thống tri thức lý luận chung nhất của con người về thế giới.",
        "provider": "vieneu",
        "voiceId": "MyDuyen",
        "audioUrl": "storage/projects/sample/audio/slide-03.wav",
        "durationSeconds": 13.5
      },
      "durationSeconds": 14.5,
      "notes": "Giải thích chữ Philosophia.",
      "layoutId": "concept-explain",
      "variantId": "text-left-image-right",
      "slotValues": {
        "body": "Hệ thống tri thức lý luận chung nhất của con người về thế giới.",
        "media": "storage/projects/sample-project/images/philosophy_concept.png"
      },
      "media": [
        {
          "id": "img-concept",
          "source": "document",
          "type": "image",
          "url": "storage/projects/sample-project/images/philosophy_concept.png",
          "alt": "Khái niệm Triết học",
          "relevance": 1.0,
          "license": "educational-fair-use"
        }
      ]
    },
    {
      "slideId": "slide-04",
      "templateId": "bullet-breakdown",
      "layoutVariant": "default",
      "title": "Nguồn gốc ra đời của Triết học",
      "subtitle": "Hai điều kiện tiền đề quyết định",
      "elements": [],
      "animations": [
        {
          "target": "#card-cog",
          "preset": "slide-in",
          "delay": 1.0,
          "duration": 1.0,
          "easing": "power2.out"
        }
      ],
      "voice": {
        "narration": "Triết học bắt nguồn từ hai điều kiện tất yếu: nhận thức và xã hội.",
        "provider": "vieneu",
        "voiceId": "MyDuyen",
        "audioUrl": "storage/projects/sample/audio/slide-04.wav",
        "durationSeconds": 15.0
      },
      "durationSeconds": 16.0,
      "notes": "Làm nổi bật hai card.",
      "layoutId": "bullet-breakdown",
      "variantId": "default",
      "slotValues": {
        "cards": [
          {
            "heading": "Nguồn gốc nhận thức",
            "body": "Tư duy trừu tượng phát triển."
          },
          {
            "heading": "Nguồn gốc xã hội",
            "body": "Chế độ chiếm hữu nô lệ xuất hiện."
          }
        ]
      },
      "media": []
    },
    {
      "slideId": "slide-05",
      "templateId": "image-explain",
      "layoutVariant": "text-right-image-left",
      "title": "Vấn đề cơ bản của Triết học",
      "subtitle": "Mối quan hệ giữa Tư duy và Tồn tại",
      "elements": [],
      "animations": [
        {
          "target": "#img-diagram",
          "preset": "zoom-in",
          "delay": 0.5,
          "duration": 1.2,
          "easing": "power2.out"
        }
      ],
      "voice": {
        "narration": "Vấn đề cơ bản lớn của mọi triết học chính là mối quan hệ giữa tư duy và tồn tại.",
        "provider": "vieneu",
        "voiceId": "MyDuyen",
        "audioUrl": "storage/projects/sample/audio/slide-05.wav",
        "durationSeconds": 18.0
      },
      "durationSeconds": 19.0,
      "notes": "Trích dẫn F. Engels.",
      "layoutId": "image-explain",
      "variantId": "text-right-image-left",
      "slotValues": {
        "media": "storage/projects/sample-project/images/basic_problem.png",
        "sideText": "Vấn đề cơ bản lớn của mọi triết học là quan hệ giữa tư duy và tồn tại."
      },
      "media": [
        {
          "id": "img-diagram",
          "source": "document",
          "type": "image",
          "url": "storage/projects/sample-project/images/basic_problem.png",
          "alt": "Vấn đề cơ bản của Triết học",
          "relevance": 1.0,
          "license": "educational-fair-use"
        }
      ]
    },
    {
      "slideId": "slide-06",
      "templateId": "comparison",
      "layoutVariant": "default",
      "title": "Chủ nghĩa Duy vật vs Chủ nghĩa Duy tâm",
      "subtitle": "Giải quyết mặt thứ nhất của Vấn đề cơ bản",
      "elements": [],
      "animations": [
        {
          "target": "#col-materialism",
          "preset": "slide-in",
          "delay": 1.0,
          "duration": 1.0,
          "easing": "power2.out"
        }
      ],
      "voice": {
        "narration": "Chủ nghĩa duy vật coi vật chất có trước. Chủ nghĩa duy tâm coi ý thức có trước.",
        "provider": "vieneu",
        "voiceId": "MyDuyen",
        "audioUrl": "storage/projects/sample/audio/slide-06.wav",
        "durationSeconds": 17.5
      },
      "durationSeconds": 18.5,
      "notes": "So sánh đối xứng 2 cột.",
      "layoutId": "comparison",
      "variantId": "default",
      "slotValues": {
        "leftColumn": {
          "title": "Chủ nghĩa Duy vật",
          "items": [
            "Vật chất có trước, quyết định ý thức"
          ]
        },
        "rightColumn": {
          "title": "Chủ nghĩa Duy tâm",
          "items": [
            "Ý thức, tinh thần có trước"
          ]
        }
      },
      "media": []
    },
    {
      "slideId": "slide-07",
      "templateId": "timeline",
      "layoutVariant": "default",
      "title": "Tiến trình hình thành Triết học Mác",
      "subtitle": "Ba giai đoạn phát triển lịch sử",
      "elements": [],
      "animations": [
        {
          "target": ".step-0",
          "preset": "fade-in",
          "delay": 1.0,
          "duration": 0.8,
          "easing": "power2.out"
        }
      ],
      "voice": {
        "narration": "Tiến trình hình thành tư tưởng của Các Mác và Ăng-ghen.",
        "provider": "vieneu",
        "voiceId": "MyDuyen",
        "audioUrl": "storage/projects/sample/audio/slide-07.wav",
        "durationSeconds": 16.0
      },
      "durationSeconds": 17.0,
      "notes": "Trục thời gian.",
      "layoutId": "timeline",
      "variantId": "default",
      "slotValues": {
        "timeline": [
          {
            "time": "1841 - 1844",
            "event": "Chuyển từ duy tâm sang duy vật",
            "highlight": true
          }
        ]
      },
      "media": []
    },
    {
      "slideId": "slide-08",
      "templateId": "formula-explain",
      "layoutVariant": "stacked-top",
      "title": "Quy luật Mâu thuẫn",
      "subtitle": "Hạt nhân của Phép biện chứng",
      "elements": [],
      "animations": [
        {
          "target": "#formula-box",
          "preset": "zoom-in",
          "delay": 0.5,
          "duration": 1.0,